{
  "actions": [],
  "constraints": [],
  "derived": [],
  "entities": [
    {
      "fields": [
        {
          "loc": {
            "file": "018-capture.beh",
            "line": 1
          },
          "name": "measurements",
          "type": {
            "t": "int"
          }
        }
      ],
      "loc": {
        "file": "018-capture.beh",
        "line": 1
      },
      "name": "Culture"
    }
  ],
  "enums": [],
  "invariants": [],
  "ir_version": "0.4",
  "nominals": []
}
